{
  "$schema": "https://json-schema.org/draft/2020-12/schema",
  "$id": "https://registry.astra.app/schema/hold-v1.json",
  "title": "astra.registry.hold/1",
  "description": "state/holds/<service_decision_id>.json — one file per moderation decision the bot has decided NOT to apply yet (MOD-9). REGISTRY-ONLY: the service never reads it, it is not in the contract's B.4 wire set, and the hold kind `unbound_yank` is this plan's own reading raised for §1.3 row 6. The entry is the whole of what a release needs, because a release runs in a later workflow run than the decision did: the run that releases it reads this file and `main`, and nothing else. `decision` is therefore a COPY of the members BOT-80 names for the kind, and `additionalProperties` is false on it because a member the bot ignored on read must not be able to reach git by riding inside a hold entry. Note what that keyword can and cannot do: it refuses the entry when the entry is READ BACK, which is the run AFTER the one that committed it, so it is not what keeps the member out. `holdEntry()` in bot/lib/holds.mjs is — it copies member by member through an allowlist read out of this file's own `properties.decision.properties`, so the two cannot drift, and M-T3.4's composers allowlist the same way on the wire. Deleting this file by hand cancels the decision, and BOT-70 records that the commit which deleted it is the cancellation.",
  "type": "object",
  "additionalProperties": false,
  "required": ["schema", "held_for", "service_decision_id", "held_at", "decision"],
  "properties": {
    "$comment": { "type": "string" },
    "schema": { "const": "astra.registry.hold/1" },
    "held_for": {
      "description": "WHY it is held, and therefore what ends it. Since contract 6.6.0 (the owner, 2026-10-29: the console's step-up is the only confirmation) the bot writes three kinds: `bound` releases by itself in the first moderation run whose trailing 24 hours, re-counted from the tree, admit it, oldest held first, or at once on an operator's MOD-52 confirmation; `unbound_removal` is cancelled by an applied `author_request` delist or a cancel record, or released on a confirmation; and `unbound_yank` is NEVER applied — no confirmation reaches it, because FLOW-79 lets only a bound account yank and an unbound one means the service erred. `reversal` and `disable_confirmation` are the kinds the rule before 6.6.0 wrote: they stay valid so that an entry left from then is read and ended rather than refused, and the bot never writes them again — a leftover `reversal` releases at once, a leftover `disable_confirmation` as a `bound` hold. bot/lib/holds.mjs owns the rules; this enum and its HOLD_KINDS are compared by bot/tests/holds.test.mjs, because a kind added to one and not the other is a hold nothing knows how to end.",
      "enum": ["reversal", "bound", "unbound_removal", "unbound_yank", "disable_confirmation"]
    },
    "service_decision_id": {
      "$comment": "Must equal the file's basename. Two independent handles on the same identity: a confirm record is matched to this entry by id, never by plugin, so an operator confirming one decision can never release a second decision that happens to name the same listing.",
      "type": "string",
      "minLength": 1,
      "maxLength": 200
    },
    "held_at": {
      "$comment": "The commit job's clock when it compiled the hold, to the second — NOT when the commit that adds this file landed, which is made after the job's gates and push. It orders `bound` holds for TRUST-26's window: the oldest `held_at` is released first (ties by id), so an entry listed again is never rewritten and never loses its place. Never from `decision.decided_at`: the registry cannot hold a decision before it knew of it.",
      "type": "string",
      "pattern": "^[0-9]{4}-(0[1-9]|1[0-2])-(0[1-9]|[12][0-9]|3[01])T([01][0-9]|2[0-3]):[0-5][0-9]:[0-5][0-9](?:\\.[0-9]+)?Z$"
    },
    "release_after": {
      "$comment": "Written, until contract 6.6.0, for `reversal` only, as `held_at` + 24 h: the floor of the 24-hour period MOD-9 then imposed. Nothing writes it now and nothing decides on it — a leftover reversal releases at once — but an entry from before 6.6.0 still carries it, so it stays valid, and bot/lib/holds.mjs refuses it on any other kind.",
      "type": "string",
      "pattern": "^[0-9]{4}-(0[1-9]|1[0-2])-(0[1-9]|[12][0-9]|3[01])T([01][0-9]|2[0-3]):[0-5][0-9]:[0-5][0-9](?:\\.[0-9]+)?Z$"
    },
    "run": {
      "$comment": "The workflow run that wrote the hold. A convenience for a reader; nothing decides on it.",
      "type": "string",
      "pattern": "^https://"
    },
    "decision": {
      "description": "The held decision, as BOT-80 names it for its kind. An `A_*` entry carries NO `moderator` and NO `declared_interest`, because no moderator decided it (DEC-14, MOD-41, n4); holds.mjs refuses one that does, by name, and the refusal is the same denylist M-T3.4 applies on the wire.",
      "type": "object",
      "additionalProperties": false,
      "required": ["service_decision_id", "code", "plugin_id", "decided_at", "reason"],
      "properties": {
        "$comment": { "type": "string" },
        "service_decision_id": { "type": "string", "minLength": 1, "maxLength": 200 },
        "code": {
          "$comment": "The codes that can be held. `M_YANK`, `M_DELIST`, `M_DEPRECATE` and `M_REVOKE` are the takedowns the bound can hold; `A_REMOVAL_REQUEST` and `A_YANK` are the author actions. `M_RELIST`, `M_UNREVOKE` and `M_IDENTITY_RESET` are the reversals MOD-9 held until contract 6.6.0 (the reset since 2.5.0, registry plan B-T4.2): no new entry carries one, and they stay here so that a leftover `reversal` entry is read and released. A code outside this list is not a thing MOD-9 holds.",
          "enum": [
            "M_RELIST",
            "M_UNREVOKE",
            "M_IDENTITY_RESET",
            "M_YANK",
            "M_DELIST",
            "M_DEPRECATE",
            "M_REVOKE",
            "A_REMOVAL_REQUEST",
            "A_YANK"
          ]
        },
        "category": { "type": "string", "minLength": 1, "maxLength": 64 },
        "plugin_id": { "type": "string", "minLength": 1, "maxLength": 64 },
        "versions": {
          "$comment": "At most 256 characters each, contract §0.7's bound on a version since 2.16.0. It was 64, and a version the registry lists can be longer, so a decision on one could not have been held.",
          "type": "array",
          "items": { "type": "string", "minLength": 1, "maxLength": 256 },
          "maxItems": 500
        },
        "decided_at": {
          "type": "string",
          "pattern": "^[0-9]{4}-(0[1-9]|1[0-2])-(0[1-9]|[12][0-9]|3[01])T([01][0-9]|2[0-3]):[0-5][0-9]:[0-5][0-9](?:\\.[0-9]+)?Z$"
        },
        "reverses": { "type": "string", "minLength": 1, "maxLength": 200 },
        "reason": {
          "$comment": "For an `A_*` code this is the one fixed registry string the token file's `fixed_reasons` lists — never author text and never a moderator's (BOT-80, MOD-41). This document cannot check that: the token file is RC-R2-1's and holds.mjs is not allowed to read it at run time (§1.2, service paths compiled in). The length floor and ceiling are MOD-41's, in code points.",
          "type": "string",
          "minLength": 10,
          "maxLength": 300
        },
        "severity": { "type": "string", "minLength": 1, "maxLength": 32 },
        "action": {
          "$comment": "`M_REVOKE` only. Since contract 6.6.0 `disable` and `block_install` are held alike, only over the bound (OPEN-OWNER-45's limit on its reason); until then `disable` was held for an operator's confirmation whatever the bound said (OPEN-OWNER-14, superseded).",
          "enum": ["warn", "block_install", "disable"]
        },
        "moderator": {
          "$comment": "Present for an `M_*` code and forbidden on an `A_*` one.",
          "type": "string",
          "minLength": 1,
          "maxLength": 64
        },
        "declared_interest": { "type": "boolean" }
      }
    }
  }
}
